question,answer
Bạn có những khóa học nào?,"Chúng tôi có các khóa học về: Thu hút và tuyển chọn nhân sự, Quản trị chính sách lương và đãi ngộ toàn diện, Nghệ thuật nhìn người và nắm bắt tâm lý người khác qua nhiều phương pháp"
Các khóa học của trung tâm là gì?,"Chúng tôi có các khóa học về: Thu hút và tuyển chọn nhân sự, Quản trị chính sách lương và đãi ngộ toàn diện, Nghệ thuật nhìn người và nắm bắt tâm lý người khác qua nhiều phương pháp"
Thông tin khóa học Thu hút và tuyển chọn nhân sự là gì?,"Khóa Thu hút và tuyển chọn nhân sự (mã: HRC-RS01) đào tạo về Kiến thức cơ bản liên quan đến việc tuyển dụng nhân sự cho doanh nghiệp, Kiến thức về quy trình tuyển dụng nhân sự: lập kế hoạch, xây dựng nguồn tuyển và sàng lọc ứng viên..."
Chi tiết về khóa học Thu hút và tuyển chọn nhân sự?,"Khóa Thu hút và tuyển chọn nhân sự (mã: HRC-RS01) đào tạo về Kiến thức cơ bản liên quan đến việc tuyển dụng nhân sự cho doanh nghiệp, Kiến thức về quy trình tuyển dụng nhân sự: lập kế hoạch, xây dựng nguồn tuyển và sàng lọc ứng viên..."
Khóa học Thu hút và tuyển chọn nhân sự dành cho ai?,"Khóa Thu hút và tuyển chọn nhân sự phù hợp với: Người học trái nghề muốn theo nghề nhân sự nghiệp vụ tuyển dụng, Người học muốn củng cố kiến thức về nghiệp vụ tuyển dụng trong quản trị nhân sự."
Ai nên học khóa Thu hút và tuyển chọn nhân sự?,"Khóa Thu hút và tuyển chọn nhân sự phù hợp với: Người học trái nghề muốn theo nghề nhân sự nghiệp vụ tuyển dụng, Người học muốn củng cố kiến thức về nghiệp vụ tuyển dụng trong quản trị nhân sự."
Thông tin khóa học Quản trị chính sách lương và đãi ngộ toàn diện là gì?,"Khóa Quản trị chính sách lương và đãi ngộ toàn diện (mã: HRC-CB) đào tạo về Kiến thức cơ bản liên quan đến việc trả lương cho người lao động tại doanh nghiệp, Kiến thức về pháp lý liên quan đến lao động như luật lao động, luật bảo hiểm xã hội, bảo hiểm y tế, bảo hiểm thất nghiệp, công đoàn, xử lý thôi việc…..."
Chi tiết về khóa học Quản trị chính sách lương và đãi ngộ toàn diện?,"Khóa Quản trị chính sách lương và đãi ngộ toàn diện (mã: HRC-CB) đào tạo về Kiến thức cơ bản liên quan đến việc trả lương cho người lao động tại doanh nghiệp, Kiến thức về pháp lý liên quan đến lao động như luật lao động, luật bảo hiểm xã hội, bảo hiểm y tế, bảo hiểm thất nghiệp, công đoàn, xử lý thôi việc…..."
Khóa học Quản trị chính sách lương và đãi ngộ toàn diện dành cho ai?,"Khóa Quản trị chính sách lương và đãi ngộ toàn diện phù hợp với: Người học trái nghề muốn theo nghề nhân sự nghiệp vụ trả lương và quan hệ lao động, Người học muốn củng cố kiến thức về nghiệp vụ trả lương trong quản trị nhân sự."
Ai nên học khóa Quản trị chính sách lương và đãi ngộ toàn diện?,"Khóa Quản trị chính sách lương và đãi ngộ toàn diện phù hợp với: Người học trái nghề muốn theo nghề nhân sự nghiệp vụ trả lương và quan hệ lao động, Người học muốn củng cố kiến thức về nghiệp vụ trả lương trong quản trị nhân sự."
Thông tin khóa học Nghệ thuật nhìn người và nắm bắt tâm lý người khác qua nhiều phương pháp là gì?,"Khóa Nghệ thuật nhìn người và nắm bắt tâm lý người khác qua nhiều phương pháp (mã: HRC-P0) đào tạo về Kiến thức cơ bản về quan điểm nhìn tướng và nắm bắt tâm lý người khác, Kỹ năng phân tích và nhìn nhận tính cách người khác qua nhiều phương pháp như: chữ viết, chữ ký, nhân tướng mặt, nhân tướng mệnh, tâm lý học nhân sự..."
Chi tiết về khóa học Nghệ thuật nhìn người và nắm bắt tâm lý người khác qua nhiều phương pháp?,"Khóa Nghệ thuật nhìn người và nắm bắt tâm lý người khác qua nhiều phương pháp (mã: HRC-P0) đào tạo về Kiến thức cơ bản về quan điểm nhìn tướng và nắm bắt tâm lý người khác, Kỹ năng phân tích và nhìn nhận tính cách người khác qua nhiều phương pháp như: chữ viết, chữ ký, nhân tướng mặt, nhân tướng mệnh, tâm lý học nhân sự..."
Khóa học Nghệ thuật nhìn người và nắm bắt tâm lý người khác qua nhiều phương pháp dành cho ai?,"Khóa Nghệ thuật nhìn người và nắm bắt tâm lý người khác qua nhiều phương pháp phù hợp với: Người học muốn tìm hiểu về nhân tướng học căn bản, Người học muốn rèn luyện nâng cao kỹ năng nắm bắt tâm lý và tính cách người khác qua nhiều phương pháp."
Ai nên học khóa Nghệ thuật nhìn người và nắm bắt tâm lý người khác qua nhiều phương pháp?,"Khóa Nghệ thuật nhìn người và nắm bắt tâm lý người khác qua nhiều phương pháp phù hợp với: Người học muốn tìm hiểu về nhân tướng học căn bản, Người học muốn rèn luyện nâng cao kỹ năng nắm bắt tâm lý và tính cách người khác qua nhiều phương pháp."
